010;Công Ty TNHH Đại Việt;1800751328;307E/9, Hoàng Quốc Việt, KV4,P An Bình Q Ninh Kiều TP - Cần Thơ;;
0100001;Đào Đức Đại;;102/42A,Đường 3/2, P. Hưng Lợi, TP Cần Thơ;;
0100002;Vũ Thị Thuỷ;;102/42A,Đường 3/2, P. Hưng Lợi, TP Cần Thơ;;
0100003;Đào Thị Bẩy;;48C, Quốc lộ 91B P. An Khánh Quận Ninh Kiều TP - Cần Thơ;;
0100004;Lê Thị chúc Mai;;Tân Lập Tân Thành, Bình Tân ,Vĩnh Long;;
0100005;Lê Thị Hoàng Trân;;48C, Quốc lộ 91B P. An Khánh Quận Ninh Kiều TP - Cần Thơ;;
0100006;Nguyễn Văn Long;;48C, Quốc lộ 91B P. An Khánh Quận Ninh Kiều TP - Cần Thơ;;
0100007;Nguyễn Văn Tấn;;KV Tân Qui, P. Trường Lạc,Q.Ô Môn ,TP CThơ;;
0100008;Ngô Văn Khương;;102/42A,Đường 3/2, P. Hưng Lợi, TP Cần Thơ;;
0100009;Nguyễn Thị Lan;;48C, Quốc lộ 91B P. An Khánh Quận Ninh Kiều TP - Cần Thơ;;
0100010;Lê Thị Huỳnh Như;;307E/9 Hoàng Quốc Việt KV 4 P An Bình TP CT;;
020;CH VLXD Đại Việt Tại Phong Điền;1800751328-001;360 ấp Nhơn Thuận, Nhơn Nghĩa, H Phong Điền, TP-Cần Thơ;;
03;Tỉnh Hải Dương;;;;
0300001;Công Ty CP Tư Vấn & Xây Lắp Công Trình VINACOGI;0800854297;Lô 56-58 Khu Đô Thị Mới Tây, P. Tứ Minh, TP Hải Dương, Tỉnh Hải Dương;;
0300002;Công Ty CP Đầu Tư Và Phát Triển Đô Thị Hải Dương;0800000143;Số 244, Nguyễn Lương Bằng, P. Thanh Bình- TP Hải Dương- Hải Dương;;
0300003;Công ty Cổ Phần Xây Dựng Thủy Lợi Hải Dương;0800289084;Khu 11, Phường Ngọc Châu, TP- Hải Dương;;
0300004;Nguyễn Đình Thành;;114 Đức Minh, P Thành Bình, TP Hải Dương;;
04;;;;;
040;Hà Nội;;;;
0400001;Công Ty Liên Hợp Xây Dựng Vạn Cường;0500297165;33 Phan Chu Trinh, Q. Hoàn Kiếm , TP-Hà Nội;;
0400002;Công Ty Cổ Phần Công Trình Đường Thủy Vinawaco;0100109593;Số 159 Phố Thái Hà, P Láng Hạ, Q, Đống Đa, TP - Hà Nội;;
0400003;Tập Đoàn Viễn Thông Quân Đội;0100109106;Số 1 Trần Hữu Dực, Mỹ Đình, Từ Liêm, Hà Nội;;
0400005;CN CTy CPhần Kim Khí Hà Nội;01001003680251;137A Cộng Hoà , P12 Q, Tân Bình TP -HCM;;
0400006;CTy CP ĐTư Xây Dựng & PTNT;0100103785;40/120 Trường Chinh - Đống Đa - Hà Nội;;
0400007;Nguyễn Hoàng Sơn;;Hà nội;;
0400008;CTy CP Đầu Tư Xây Dựng CDC;0101684701;Số 96 Định Công , Phương Liệt, Thanh Xuân Hà Nội;;
0400009;Cty CP ĐT PT Hà Thành;0101115952;102, Thái Thịnh, Đống Đa, Hà Nội;;
0400010;CTy TNHH SX & TM Kim Đại Vương;0101416621;20 Ngõ 202 F, Đội Cấn, Hà Nội;;
0400011;Tổng CTy Cổ Phần Bưu Chính Viettel;0104093672;Số 1 Giang Văn Minh, P Kim Mã, Q Ba Đình, TPHN;;
0400012;CTy TNHH AN Ninh Mạng BKAV;0101360697;P105 B12, TT Kim Liên, P Kim Liên, Q đống đa, Hà Nội;;
0400013;Công Ty Cổ Phần Đầu Tư Xây Dựng Đại An;0101646022;Số 36B,Ngõ 41,Thái Hà, PTrung Liệt, QĐống Đa, HN;;
0400014;CTy CP đTư & PTriển Nhà Hà Nội Số 36;0101566190;Tòa nhà số 09, tổ 64, Trung Kính, Yên hòa Cầu Giấy Hà Nội;;
0400015;Công Ty Cổ Phần Tư Vấn XD  & Chuyển Giao Công Nghệ;0102722759;Số 2, Ngõ 162/34/9 Nguyễn Văn Cừ, P. Bồ Đề, Q. Long Biên, Hà Nội;;
0400016;Công Ty CP Đầu Tư TM Và  Xây Dựng Giao Thông 1;0100104732;Số 548 Nguyễn Văn Cừ, Q. Long Biên, TP Hà Nội;;
0400017;Công ty CP Đầu Tư và XD Giao Thông Phương Thành;0101511949;Số 18 Đường Giải Phóng, Quận Đống Đa, Hà Nội;;
0400018;Công Ty Cổ Phần Công Trình Đường Thủy Vinawaco;0100109593;Số 159 Phố Thái Hà, P Láng Hạ, Q, Đống Đa, TP - Hà Nội;;
0400019;Công Ty CP Đầu Tư TM Và  Xây Dựng Giao Thông 1;0100104732;Số 548 Nguyễn Văn Cừ, Q. Long Biên, TP Hà Nội;;
0400020;Tạp Chí Thuế;0100231226001;466 La Thành - Hà Nội;;
0400021;Công Ty CP Cung ứng Dịch Vụ Vật Tư Thiết Bị Công Trình;0102963666;113 Lô1, Khu Tái Định Cư, P. Long Biên, Q Long Biên, TP Hà Nội;;
0400022;Công Ty CP TV ĐT Và XD Hương Giang;0100821401;28/66 Tân Mai, Hoàng Mai, Hà Nội;;
0400023;Công Ty CP Giao Thông Hà Nội;0500453135;Km 15 + 500 QL6A, P. Yên Nghĩa, Q. Hà Đông, TP- Hà Nội;;
0400024;Công Ty Cổ Phần Cầu 12 -Cienco 1;0100104651;Số 463 Nguyễn Văn Linh, P. Phúc Đồng, Q Long Biên, TP Hà Nội;;
0400025;Công Ty CP Công Trình  Đường Thủy Vinawaco;0100109593;Số 159, Phố Thái Hà, P Láng Hạ, Q. Đống Đa, TP Hà Nội;;
0400026;Công Ty Cổ Phần Đầu Tư UDIC;0104406491;Số 24 Lô 1B, Khu Đô Thị Trung Yên, Cầu Giấy, Hà Nội;;
0400027;Công Ty CP Công Trình  Đường Thủy Vinawaco;0100109593;Số 159, Phố Thái Hà, P Láng Hạ, Q. Đống Đa, TP Hà Nội;;
0400028;Công Ty CP Công Trình  Đường Thủy Vinawaco;0100109593;Số 159, Phố Thái Hà, P Láng Hạ, Q. Đống Đa, TP Hà Nội;;
0400029;Công ty Cổ Phần Hàng Không VIETJET;0102325399;125 Trúc Bạch, Quận Ba Đình, Hà Nội;;
0400031;Công Ty CP Công Trình Đường Thủy Vinawaco;0100109593;Số 159 Phố Thái Hà, P Láng Hạ, Q. Đống Đa, TP Hà Nội;;
0400032;Công Ty Cổ Phần Cầu 12;0100104651;Số 463 Nguyễn Văn Linh, P Sài đồng, Q Long Biên, TP Hà Nội;;
0400033;Lương Văn Cường;;Hà Nội;;
0400034;Công ty Cổ Phần BKAV;0101360697;Tầng 2, tòa nhà HH1- Khu ĐT Yên Hòa, P. Yên Hòa, Q. Cầu Giấy TP_ Hà Nội;;
0400035;Tổng Công Ty 789;0100107613;Số 147 Hoàng Quốc Việt, Q. Cầu Giấy, TP- Hà Nội;;
0400036;Công Ty Cổ Phần Đầu Tư Xây Dựng Đại An;0101646022;Số 36B,Ngõ 41,Thái Hà, PTrung Liệt, QĐống Đa, HN;;
0400037;Công Ty Cổ Phần Đầu Tư Xây Dựng Đại An;0101646022;Số 36B,Ngõ 41,Thái Hà, PTrung Liệt, QĐống Đa, HN;;
0400038;Cty CP TV ĐT Và Chuyển Giao Công Nghệ Việt Nam;0101431098;Số 01 Ngõ 95, Phố Chùa Bộc, P. Trung Liệt, Q. Đống Đa, Hà Nôj;;
0400039;CôngTy CP Công Trình Đường Thủy Vinawaco;0100109593;Số 159 Phố Thái Hà, P Láng Hạ, Q. Đống Đa, TP Hà Nội;;
0400040;Công ty CP Đào Tạo và Tư Vấn Đầu Tư XD Hà Nội;0101657391;Kim Lữ, P. Đại Kim, Q. Hoàng Mai, TP- Hà Nội;;
0400041;Công Ty CP Xây Dựng Công Trình Thủy Hà Nội;0101708991;SN 43 Liên Cơ, Đ.Nguyễn Cơ Thạch, P.Cầu Diễn, Q.Nam Từ Liêm, TP Hà Nội;;
0400043;Công Ty Cổ Phần Cầu 12 - Cienco 1;0100104651;Số 463 Nguyễn Văn Linh - P. Phúc Đồng -Q. Long Biên- Hà Nội;;
0400044;Công ty Cổ Phần Constrexim  Số 1 ( Confitech);0101615761;Tầng 13 Tòa Nhà TTC- Phố Duy Tân-P.Dịch Vọng Hậu, Q.Cầu Giấy-TP-HN;;
0400046;Công ty TNHH Đầu Tư Phát Triển Kỹ Thuật Minh Long;0106154257;Số 29 ngõ 67 Nguyễn Văn Cừ, P. Ngọc Lâm, Q. Long Biên, TP Hà Nội;;
0400047;Công Ty Cổ Phần Cầu 12-Cienco 1;0100104651;Số 463 Nguyễn Văn Linh, P. Phúc Đồng, Q. Long Biên - TP Hà Nội;;
0400048;Công ty CP Xây Dựng Công Trình Thủy Hà Nội;0101708991;SN 43 Liên Cơ, Đ.Nguyễn Cơ Thạch, P.Cầu Diễn, Q.Nam Từ Liêm, TP Hà Nội;;
0400049;Công Ty Cổ Phần Tư Vấn XD  & Chuyển Giao Công Nghệ;0102722759;Số 2, Ngõ 162/34/9 Nguyễn Văn Cừ, P. Bồ Đề, Q. Long Biên, Hà Nội;;
0400050;Công Ty CP XD Hạ Tầng Giao Thông Thủy Lợi Hà Nội;0101482550;Nhà N22 + 23, Đường Quảng Khánh, P. Quảng An, Q .Tây Hồ, TP Hà Nội;;
0400051;CN Tổng CTy XD và PT Hạ Tầng- Cty KT Nền Móng và XD 20;0100106440-010;Số 61E La Thành, Quận Đống Đa, Hà Nội;;
0400052;Công ty CP Phát Triển Xây Dựng Và TM  Thuận An;0101520598;Số141,Đ. Trường Chinh,Tổ 20, P.Phương Liệt, Q.Thanh Xuân, TP- Hà Nội;;
0400056;Công Ty TNHH Một Thành Viên 319.2;0105870441;Số 145/154, Đường Ngọc Lâm, Phường Ngọc Lâm, Q. Long Biên, TP- Hà Nội;;
0400057;Công ty Cổ Phần Công Trình Đường Thủy - Vinawaco;0100109593;Số 159 Phố Thái Hà, Phường Láng Hạ, Q. Đống Đa TP- Hà Nội;;
0400058;Công Ty CPTM và Tư Vấn Tân Cơ;0101021398;Số 92, Phố Yết Kiêu, P Nguyễn Du, Q Hai Bà Trưng, TP Hà Nội;;
0400059;Nguyễn Xuân Khu;;;;
0400060;Chi Nhánh 2- Công Ty TNHH MTV ĐT Và PT Trường An;0101371970-003;33 Phạm Ngũ Lão, P. Phan Chu Trinh, Q Hoàn Kiếm, Hà Nội;;
0400061;Công ty Cổ Phần Xây Dựng & Kỹ Thuật Thuận Thành;0105184812;Số 2, Ngõ 94 Đường Núi Đôi, Thị Trấn Sóc Sơn, H. Sóc Sơn, TP. Hà Nội;;
0400062;Công ty Cổ Phần Tập Đoàn Quốc Tế Đông á;0101933309;Số 85, Phố Nguyễn Văn Trỗi, P. Phương Liệt, Q. Thanh Xuân, TP. Hà Nội;;
0400063;Công ty Cổ Phần Đầu Tư Và Thương Mại Lam Giang;0201138985;Khu Đô Thị Mới Long Sơn, P. Quán Toan, Q. Hồng Bàng, TP. Hải Phòng;;
0400064;Công ty Cổ Phần Tập Đoàn Quốc Tế Đông á;0101933309;Số 85, Phố Nguyễn Văn Trỗi, P. Phương Liệt, Q. Thanh Xuân, TP. Hà Nội;;
0400065;Công Ty CP Xây Dựng Công Trình Thủy Hà Nội;0101708991;SN 43 Liên Cơ, Đ.Nguyễn Cơ Thạch, P.Cầu Diễn, Q.Nam Từ Liêm, TP Hà Nội;;
0400066;Công Ty Cổ Phần Công Trình Đường Thủy Vinawaco;0100109593;Số 159 Phố Thái Hà, Phường Láng Hạ, Q. Đống Đa TP- Hà Nội;;
0400067;Công ty TNHH Một Thành Viên Xây Lắp Điện 4;0100100872;Tổ 1 Thị Trấn Đông Anh, H. Đông Anh, TP. Hà Nội;;
0400068;Công ty Cổ Phần Phát Triển Đầu Tư Hà Nội;0101126778;Lô đất Nơ 4.5, Đường Lê Văn Lương, P.Nhân Chính, Q. Thanh Xuân, Hà Nội;;
0400069;Công Ty TNHH Xây Dựng Minh Chính;0313234729;43 R22 Hồ Văn Huê, Phường 9, Quận Phú Nhuận, TP. HCM;;
0400070;Chi Nhánh 2- Công ty CP Đầu Tư Xây Dựng & Phát Triển Trường An;0101371970-003;33 Phạm Ngũ Lão, P. Phan Chu Trinh, Q. Hoàn Kiếm, TP. Hà Nội;;
0400071;Công ty Cổ Phần Công Trình Đường Thủy- Vinawaco;0100109593;Số 159 , Phố Thái Hà, P. Láng Hạ, Q. Đống Đa, TP. Hà Nội;;
0400072;Công ty CPTM DV BAILAN Việt Nam;0106905697;Số 16, Tổ 45, Ngõ 12 Khuất Duy Tiến, Thanh Xuân Trung, Thanh Xuân, HN;;
0400073;Công ty Xây Dựng Và Đầu Tư Bạch Đằng 6;0200157840-007;SN 4 Ngõ 583, Đ. Nguyễn Trãi, P. Thanh Xuân Nam, Q. Thanh Xuân, TP. Hà Nội;;
053;Quảng Trị;;;;
0530001;Công Ty TNHH Xây Dựng PVN;3100483074;Khu phố 1, TT Ba Đồn, H Quảng Trạch, Quảng Bình;;
058;Khánh Hòa;;;;
0580001;Công ty TNHH Tư Vấn Kiến Trúc và XD An Phát;4200528926;Nhà B1 Chung Cư  Số 02 Lê Hồng Phong, TP- Nha Trang;;
0580002;Doanh Nghiệp Tư Nhân Hoàng Huy Phát;4200653934;272 B Thống Nhất, Nha Trang, Khánh Hòa;;
0580003;Công ty CP Đầu Tư TM và XD  Giao Thông Khánh Hòa;4201593318;Tổ 5 Thị Trấn Khánh Vĩnh, Huyện Khánh Vĩnh, Tỉnh Khánh Hòa;;
0580004;Công Ty Cổ Phần Đầu Tư Và Xây Dựng 25 Khánh Hòa;4201596446;Số 21 Lê Hồng Phong-TT Khánh Vĩnh-H. Khánh Vĩnh-T.Khánh Hòa;;
0580005;Công Ty TNHH Thắng Lợi;4200431201;49A Lê Hồng Phong- Phường Phước Tân, TP- Nha Trang- Tỉnh Khánh Hòa;;
0580006;DNTN Trần Ngọc Hòa;4200548785;270B Thống Nhất, Nha Trang, Khánh Hòa;;
080;TP. Hồ Chí Minh;;;;
0800001;Nguyễn Mạnh Thuật;;;;
0800002;Cty TNHH Thương Mại Kim Tín;0301911983;69 Nguyễn Thi, P13 Quận 5 Tp-HCM;;
0800003;Cty TNHH TM Thép Nam Việt;0301985093;67 Xuân Hồng - Phường 12 - Quận Tân Bình - TP - HCM;;
0800004;CTy TNHH TM & Sản Xuất Thép Việt;0301121174;289 Lý Thường Kiệt- P15 - Quận 11, TP - HCM;;
0800005;Công Ty TNHH TM Tân Nghệ An;0303098763;73 Cao Thắng - P13 Quận 3 TP - HCM;;
0800006;Cty TNHH TM Thép Toàn Thắng;0301424404;8/42 Nguyễn đình Khơi, P4 , Tân Bình TP -CM;;
0800007;Công ty CP Sản Xuất và Thương Mại Thép Nguyễn Minh;0301805248;D6/31 Âp 4 Thị Trấn Tân Trúc, Bình Chánh TP - HCM;;
0800008;Công Ty TNHH XD TM Hoàng Hảo;0302073170;81 Đường 41 Phường 16 Q8, TP -HCM;;
0800009;CN CTy CP VTư HGiang Tại TP - HCM;1800506679-007;166 Bình Lợi, P 13, Bình Thạnh  TP -HCM;;
0800010;CTy TNHH Thành Lợi;0301899694;78 Ngô Quyền P5, Q10 TP - HCM;;
0800011;Nguyễn Văn Dũng;;;;
0800012;XN Vận Tải & Kinh Doanh Tổng Hợp;0300607067003;30 Kha Vạn Cân , P Hiệp - Bình Chánh TP -HCM;;
0800013;Cty TNHH Bình Phương;3600804872;ấp Bình Thạch, Xã Bình Hoà - Huyện Vĩnh Cửu TP - HCM;;
0800014;Đặng Quốc Phong;;;;
0800015;CN CTy Đầu Tư Xây Dựng Quyết Tiến;1000139243-003;Số 266 Nguyễn Văn Lượng , P16, Q. Gò Vấp, TP - HCM;060005944875;NH Sài Gòn Thương Tín CN Gò Vấp
0800016;Cửa Hàng Lưới Rào;0302022962;272 Trường Sơn Tam Bình Thủ Đức;;
0800017;Công Ty CP TM An Thành Phát;0306707607;178 Lý Thường Kiệt, P 14 Q10 TP -HCM;;
0800018;Công Ty TNHH Hoà Phát;0301968108;450-452 đường số 7 Phường Tân Taọ Q, Bình Tân TP - HCM;;
0800019;Công Ty CP Đầu Tư Xây Dựng Trung Hà;0304340015;Số 14 Huỳnh Đình Hai, P 24 , Quận Bình Thạnh TP - HCM;;
0800020;Hợp Tác Xã Vận Tải & Du Lịch Mỹ Tường;0302735836;144/1KP, P Thanh Xuân Q12, TP - HCM;;
0800021;CTy CP DV - VT Trường Thọ;0305898282;Khu Phố 7 P. Trường Thọ, Q, Thủ đức TP - HCM;;
0800022;Cty TNHH SX - VT- TM Đại Trường Thịnh;0302948062;265C/4 Quốc lộ 1A, KP4 , P. Tam Bình Q, Thủ Đức TP - HCM;;
0800023;Công Ty Cổ Phần Kim Tín Thép;0308611643;69 Nguyễn Thi - Phường 13 - Quận 5 TP - HCM;;
0800024;Công Ty TNHH Xây Lắp 11;0302384715;958/26/13 Lạc Long Quân, P8, Q. Tân Bình,TPHCM;;
0800025;Dư Thị Thuận;;93/103 K, Lê đức Thọ P17 -Quận Gò Vấp TP - HCM;;
0800026;Cty TNHH VT - DV GNhận XNK Vạn Lạc Thành;0305398219;74 đường 43, KP4, P Tân Quy, Q7 TP - HCM;;
0800027;XN Vận Tải & KDTH;0300607067003;30 Kha  Vạn Cân, P, Hiệp Bình Chánh Thủ đức TP - HCM;;
0800029;CTy CP Vật Tư Hậu Giang CN TP - HCM;1800506679-007;166 Bình Lợi, P13. Q, Bình Thạnh TP - HCM;;
0800030;Công Ty CP Thép Tân Thuận;0304843770;136A, Bùi Văn Ba, P, Tân Thuận Đông Q7 ,TP - HCM;;
0800031;CTy TNHH ĐầuTư Xây Dựng Sáu Hai Tám;0304397702;Tầng 3 Tòa Nhà 154, Đường Nhạc Sơn, P. Kim Tân, TP. Lào Cai, Tỉnh Lào Cai;10201000173998;NHTMCP Công Thương VN CN Lào Cai
0800032;CTy Cổ Phần Thương Mại Thép An Khánh;0307974764;359 Lê Văn Sỹ, Phường 13. Quận 3 TP - HCM;;
0800033;Công Ty TNHH Thép Kỳ Đồng;0302319201;Lô C1/I Đường số 2E, KCN Vĩnh Lộc, Bình Chánh - TP HCM;;
0800034;CN CTy TNHH SX TM Thép Việt Thành;0301692964;D7 /15 Quốc lộ 1A , Tân Túc, Huyện Bình Chánh TP - TPHCM;;
0800035;Công ty TNHH Đại Long Minh;0305649896;702/3F Sư Văn Hạnh P12, Quận 10, TP - HCM;;
0800036;Công Ty CP Đầu Tư XDTM Cơ Hội Mới;0303680837;Số 4-6 Nguyễn Thái Học , P, Cầu Ông Lãnh Q1, TP - HCM;;
0800037;CTy CP XD Vận Tải  ĐT  KD Nhà Hải Đăng;0302756554;30 Phạm Ngũ Lão - P3 , Quận Gò Vấp TP - HCM;;
0800038;Công Ty TNHH Toàn Khang;0303214586;Số 1, Hồ Bác Kiện, P15, Quận 10 TP - HCM;;
0800039;Công Ty TNHH XS TM Tân Quốc Hưng;0304239713;428 QL 1A, P, Hưng Hòa B, Quận Bình Tân TP - HCM;;
0800040;Cty TNHH SX Lê Phan Phan Gia;0303958828;490 QL1A, P. Tam Bình Q, Thủ đức TP- HCM;;
0800041;Công Ty Cp Kim Khí Tp.HCM;0300399360;193 đinh Tiên Hoàng, Q1, TPHCM;;
0800042;CTy CP Nhà Rồng;0302548681;42 Hoang Dieu ,Quan 4 , TP HCM;31010.000275348;NH DT & PT Viet nam CN TP HCM
0800043;Công Ty TNHH MTV Trí Liên;0305617534;270/26/12 Phan Đình Phùng, P1, Q. Phú Nhuận, TP.HCM;;
0800044;Cty TNHH Nhật Trường Vinh;0303469400;958 Hương lộ 2, KP6, Bình Tri Đong A, Q. Bình Tân, TP.HCM;;
0800045;CTy Cung ứng Nhân Lực QT &TM(SONA);0100110415001;138 Hoa Lan, P.2, Q. PN, TPHCM;;
0800046;CTy CP Đầu Tư Xây Dựng Sài Gòn Sơn;0309143116;A4 Lầu 5, Tòa nhà Bigemco, 2/2 Lý Thường Kiệt, P.15, Q.11, Tp. HCM;;
0800047;CTY TNHH SX và TM Đại Phúc;0302482409;Lô 08 Đường Song Hành, KCN Tân Tạo, Q Bình Tân, TP HCM;;
0800048;Cty TNHH TM Hoàn Phúc;0302241467;14 Vũ Tùng, P2, Quận Bình Thạnh, TPHCM;;
0800049;Công Ty Cổ Phần VLXD & TTNT TP - HCM;0302495140;215-217 Trần Hưng đạo , Quận 1 TP - HCM;;
0800050;CTy TNHH MTV Thảo Quyên Phát;3602215417;K5/19G/Tổ 67, KP3, P. Bửu Hòa, Biên Hòa, đồng Nai;;
0800051;Bánh Mì Như Lan;0304166977;367 Hai Bà Trưng, P8, Q.3, TPHCM;;
0800052;Cty TNHH Thương Mại Thép Trường Huy;0308538496;36 Ngô Bệ, P.13, Q. Tân Bình;;
0800053;Công Ty TNHH TM Thép POMINA;0310206787;Số 289 Lý Thường Kiệt, Quận 11, TPHCM;007.100.5739946;Tại NH Ngoại Thương VN-CN TP.HCM
0800054;CN CTy CP Đầu Tư XD & Du Lịch ( TP Hà Nội);0100107074-006;Số 48(lầu2), Đường 28, KDC Bình Phú, P10, Q.6, TPHCM;;
0800055;Nguyễn Trọng Trung;;;;
0800056; Cty CP Phát Hành Sách TPHCM Nhà Sách FAHASA Hoà Bình;0304132047;Số 01 Hoà Bình;;
0800057;Công Ty TNHH Hạ Châu;0310362440;Số 9 đường số60,ấp xóm đồng xã Tân PhúTrung,H.Cù Chi, TP HCM;;
0800058;Công Ty TNHH Thép Việt Nga;1100728443;Lô B081-082 Đường Số 1, KCN Đức Hòa 1, Long An;;
0800059;Công Ty TNHH Quý Thành;0304513518;923 ấp 3, Bình Hưng, Bình Chánh;;
0800060;Công Ty TNHH MTV Thương Mại và Gia Công Dũng Xíu;0306119475;366 Thoại Ngọc Hầu, Phường Phú Thạnh, Q Tân Phú, TPHCM;;
0800061;Cty HHCN Kao Minh;3600713985;KCN Hố Nai, H. Trảng Bom, đồng Nai;;
0800062;DNTN SXuất Gia Công TM Hoàng Thắng;0305570420;17 đô đốc Long, P Tân Quý, Q Tân Phú;;
0800063;Phạm Văn Bàn (Hiệp);;Số nhà 21, đường 21, TPhcm;;
0800064;DNTN Lê Hoàng Dũng;0303142155;36 Bùi Tư toàn, AN Lạc, Bình Tân;;
0800065;DN Tư Nhân Thương Mại DV Trí Tài;0301429956;D5/41, Quốc Lộ 1A, TT Tân Túc, H. Bình Chánh, TPHCM;;
0800066;CH Kinh Doanh ắc Quy Hưng Lập;0305730931;29 Tạ uyên, P15, Q5;;
0800067;Hùng Hải Kinh Doanh Dây Cáp Tơ xích;0301959840;KA 27, Trần Xuân Soạn, Q 7;;
0800068;CTy TNHH Sản Xuất TM Hào Ký;0307297431;A2/9 Quy Đức, ấp 1, Xã Hưng Long, Huyện Bình Chánh, TPHCm;;
0800069;Lê Văn Hùng;0302482166;S.32 Chợ Vật Tư, P10, Q5 TPHCM;;
0800070;DNTN DV VT Đường Sông Thuận Thiên;0302326174;287 Trần Xuân Soạn, P. Tân Kiểng, Q7 TPHCM;;
0800071;Công Ty  CP Thương Mại Hoa Lư;0303974682;22/9 nguyễn văn săng, P. Tân Sơn Nhì, Q. Tân Phú, TPHCM;;
0800072;Cty Cổ Phần Xây Dựng SX Và TM Lộc Thiên Dương;0303558280;98 Nguyễn Thanh Tuyền, Phường2, Q. Tân Bình, TPHCM;;
0800073;Công Ty CP ĐT XD & KD Nhà Thái Sơn;0306985812;Số 3, Đường 3/2, Phường 11, Quận 10, TPHCM;;
0800074;CTy Cổ Phần Đầu Tư & Thương Mại Phú Minh Nguyên;0304166670;17/07 Đinh Tiên Hoàng, Phường Đa Kao, Q1, TPHCM;;
0800075;CTy TNHH Đầu Tư Xây Dựng TM Hà Tiến;0303330409;120 Phạm Văn Bạch, P15, Q. Tân Bình, TPHCM;;
0800076;DNTN Vận Tải Hải An;0305477319;Số 2, Cầu Bá Thước, P7, Q Phú Nhuận, TPHCM;;
0800077;CTy TNHH MTV Máy- Thiết Bị Dầu Khí Sài Gòn;0309969953;351/31 Nơ Trang Long, P13, Q. Bình Thạnh, TPHCM;;
0800078;Công Ty Cổ Phần Nam Thái Sơn;0310031671;Số 3 Đường 3/2, Phường 11, Quận 10, TP - HCM;;
0800079;Cty CP Quảng Cáo Xây Dựng Sông Lam;0310438040;21/1 Nguyễn Thượng Hiền, P5, Q. Bình Thạnh, TP HCM;;
0800080;Công Ty TNHH Sáu Lu;0303621567;C3/58, ấp 3, Xã Bình Chánh, Huyện Bình Chánh, TPHCM;;
0800081;Công Ty TNHH MTV Tổng Công Ty Thái Sơn;0300533471;Số 3, đường 3/2, Phường 11, Q10, TPHCM;;
0800082;Công Ty Cổ Phần Xây Dựng Việt Thành Nam;0309863890;Số 76 Chu Văn An, Phường 26, Q Bình Tân, TPHCM;;
0800083;Công Ty TNHH SX TM Bắc Việt;0302413860;Số 23 Nguyễn Bá Tòng, P Tân Thành, Q. Tân Phú, TPHCM;;
0800084;Công Ty TNHH Hưng đại Lộc;0305754682;755 C Quốc Lộ 13, KP 3, P Hiệp Bình Phứơc, Q Thủ đức, TPHCM;;
0800085;CN Phía Nam Cty TNHH MTV Tổng CTy XD Trường Sơn;0100512273003;30D Phạm Văn Trị, Quận Gò Vấp, TPHCM;;
0800086;Ngô Văn Hoàn;;;;
0800087;Công ty TNHH  Thương Mại Vân Tú;0301714142;843 Lạc Long Quân, Phường 10, Q. Tân Bình, TP- HCM;;
0800088;Công ty CP ĐT và XD Công Trình Giao Thông Sài Gòn;0311485075;Số 62A Đường số 30, Phường 6, Q. Gò Vấp, TP- HCM;;
0800089;Cty TNHH MTV ống Thép Hòa Phát Bình Dương;3700906187;đường 26, KCN Sóng Thần2, Huyện Dĩ An, Tỉnh Bình Dương;;
0800090;Bùi Thị Hoa;;32/8/9  Khu phố 8, P. Ttường Thọ, Thủ đức, TPHCM;;
0800091;Công Ty TNHH Xây Dựng Thương Mại Quốc Tế Liên Việt;0311818528;143 Tô Hiến Thành, Phường 13, Quận 10, TPHCM;138061369;NHTMCP á Châu CN Tùng Thiện Vương
0800092;Công ty TNHH TM DV Mai Lan Anh;0303940362;20 Điện Biên Phủ, P25, Q. Bình Thạnh TP- HCM;;
0800093;Cty Cổ Phần Xây Dựng Và Kinh Doanh Địa Ôc Hòa Bình;0302158498;235 Võ Thị Sáu, Phường 7, Quận 3, TPHCM;;
0800094;Công ty TNHH TM & DV Quang Mười;0302176553;C9/36 Khu Phố 3, QL 1A, TTrấn Tân Túc, H Bình Chánh, TPHCM;;
0800095;Công Ty TNHH Trần Huỳnh Quang;0304609668;15/16 TL 50 KP 02, P Thạnh Lộc, Q 12, TPHCM;;
0800096;Công Ty TNHH Thép Long Hiệp;0311683937;Số 3/21A - Âp 3 - Xã Tân Quý Tây, H. Bình Chánh- TPHCM;;
0800097;Công TY TNHH MTV ống Thép Hòa Phát Bình Dương;3700906187;Lô M đường 26, KCN Sóng Thần2, P Tân đông Hiệp, Thị Xã Dĩ An, Tỉnh BD;;
0800098;Công Ty CP Đầu Tư & Phát Triển Xây Dựng (INVESTCO);0301442227;201 Võ Thị Sáu, Quận 3, TP. Hồ Chí Minh;;
0800099;Công Ty Cổ Phần Tập Đoàn Thép Nguyễn Minh;1101359647;Lô D1-9 đến D1-22, KCN Vĩnh Lộc2, Đường VL2, Âp Voi Lá, Xã Long Hiệp, H Bến Lức, T Long An;;
0800100;Công Ty TNHH Thương Mại Thép Mười đây;0302158402;23 đường Số 2, Cư Xá Lữ Gia, Phường An Bình, Q Ninh Kiều, TP Cần Thơ;;
0800101;Cty CPVLXD&TTNT TPHCM- Trung Tâm KD VLXD& TTNT Số 6;0302495140;Lầu2, 215- 217 Trần Hưng Đạo, Quận1, TPHCM;;
0800102;Công Ty Dịch Vụ và Thương Mại Chơn Thành;0303792837;416 Chung Cư Lô A, P. Sơn Kỳ, Q. Tân Phú, TP- HCM;;
0800103;CN Công ty CP Đầu Tư XD và DV Kho Bãi Phú Tài;0304853183-001;Góc Đường số 10-Đại Lộ Độc Lập- Khu Căn Cứ 301-Dĩ An- Bình Dương;;
0800104;Công Ty TNHH Cơ Khí Xây Dựng Gia Hưng;0305295051;B5/25K Trần Đại Nghĩa, ấp 2, Xã Tân Kiên, Huyện Bình Chánh TP-HCM;;
0800105;CHBL Xăng Dầu Số 2- Cty TNHH Nguyên Cường;0303688794;KP3 - Quốc lộ 1, P. An Phú Đông, Q12 TPHCM;;
0800106;Công Ty TNHH Một Thành viên Lộc Khải;0305163908;408 Lỹ Bán Bích, P Hòa Thạnh, Q Tân Phú, TPHCM;;
0800107;Công Ty TNHH TM Và SX Phụng Đài;1101519964;Tỉnh Lộ 10, Âp Bình Tiền2, Xã Đức Hòa, H . Đức Hòa, T. Long An;;
0800108;Công Ty TNHH  Cầu Quyết Tiến;0311930142;Số nhà 152, Đường Nhạc Sơn, Phường Kim Tân, Thành Phố Lào Cai, T. Lào Cai;060054349486;NH TMCP Sài Gòn Thương Tín CN Q8
0800109;Công ty TNHH Sao Mai Anh;0303577004;40/1Bis, QL 1A, KP4, P. Tân Thuận , Quận 12, TPHCM;;
0800110;Xí Nghiệp Bán Lẻ Xăng Dầu ( CH Xăng Dầu Số 12);0300555450-001;15 Lê Duẩn, P. Bến Nghé, Quận 1, TPHCM;;
0800111;Công ty CP Xây Dựng Số Mười Tám Thăng Long ( TLG 18);0306117911;Số 127B, Đinh Tiên Hoàng, P3, Q. Bình Thạnh, TP- HCM;;
0800112;Công Ty Cổ Phần Tư Vấn Xây Dựng Thủy Lợi II;0300566614;169 Trần Quốc Thảo, P9, Quận 3, TP- HCM;;
0800113;Công ty TNHH Việt Hải Long;0311971540;81 Đường 41, Phường 16, Quận 8, TP- HCM;;
0800114;Công ty TNHH MTV TMDV Sắt Thép Việt Đức;0309454062;528/3 Lê Văn Việt, P. Long Thạnh mỹ, Q9, TP-HCM;;
0800115;Công ty TNHH TM Thép Minh Phát;0305387111;180 Kha Vạn Cân, P. Hiệp Bình Chánh, Q, Thủ đức , TPHCM;;
0800116;Tổng Công Ty Vật Liệu XD Số 1 - TNHH Một Thành Viên;0300402493;Tầng 15, Sailing Tower, 111A Pasteur, Q1, TPHCM, VN;;
0800117;Công ty TNHH ĐTXD Huy Hưng Phát;0305451529;396/39/5 Dương Quảng Hàm, P5, Q. Gò Vấp, TP-HCM;;
0800118;Công Ty Cổ Phần Diệc Phú Thành;0301922216;261- 263 An Dương Vương P03, Q5;;
0800119;Lê Thị Vi;;;;
0800120;Công Ty Cổ Phần Thép Trường Sơn;0309022489;69/29 Nguyễn Cửu Đàm, P. Tân Sơn Nhì, Q. Tân Phú, TPHCM;;
0800121;Công Ty TNHH Thép Bảo Tín;0311458762;136 Nguyễn Văn Thủ, P Dakao, Quận 1, TPHCM;;
0800122;Cty TNHH TMDV Vận Tải Hoàng Tuấn;0305429890;48 đỗ Xuân Hợp, P. Phước Long A, Q9, TP-HCM;;
0800123;Công ty TNHH Thép Hải Châu;0311595945;02 Lô D Khu 300, Bến Chương Dương, P. Cầu Kho, Q1, TP-HCM;;
0800124;CTY TNHH TMDV  Vận Tải Trúc Khanh;0305021413;143/18 Nguyễn Trãi, Phường 2, Quận 5, TPHCM;;
0800125;Công Ty TNHH Đường Bay;0306139288;Số 89/27 Đường 59, Phường 14, Q Gò Vấp, TPHCM;;
